{
  "$schema": "https://json-schema.org/draft/2020-12/schema",
  "$id": "https://schemas.vev.software/fabric/v1/tenant-membership-snapshot.schema.json",
  "title": "TenantMembershipSnapshot",
  "description": "Portable, versioned, authoritative list of the identities that are members of one tenant, with opaque role bindings (fabric#57). It carries data only: not credentials, not the transport that delivers it, and not product role policy. A consumer applies it independently of how the snapshot was authenticated.",
  "type": "object",
  "additionalProperties": false,
  "required": ["schemaVersion", "tenant", "sequence", "issuedAt", "validUntil", "members"],
  "properties": {
    "schemaVersion": {
      "const": 1,
      "description": "Contract version. A consumer rejects every value it does not know (fail closed)."
    },
    "tenant": {
      "type": "object",
      "additionalProperties": false,
      "required": ["tenantId"],
      "properties": {
        "tenantId": { "type": "string", "minLength": 1 }
      }
    },
    "sequence": {
      "type": "integer",
      "minimum": 1,
      "description": "Monotonic revision within the tenant. A consumer never accepts a lower sequence than it has applied; an equal sequence is accepted only when the content is identical."
    },
    "issuedAt": { "type": "string", "format": "date-time" },
    "validUntil": {
      "type": "string",
      "format": "date-time",
      "description": "Instant at which the snapshot stops conferring membership. Must be later than issuedAt."
    },
    "members": {
      "type": "array",
      "description": "The complete membership. Absence from this list means the identity is not a member; there is no per-member disabled flag.",
      "items": {
        "type": "object",
        "additionalProperties": false,
        "required": ["identity", "roles"],
        "properties": {
          "identity": {
            "type": "object",
            "additionalProperties": false,
            "required": ["issuer", "subject"],
            "properties": {
              "issuer": { "type": "string", "minLength": 1, "description": "Identity provider issuer (the OIDC 'iss'). Compared exactly." },
              "subject": { "type": "string", "minLength": 1, "description": "Stable subject within that issuer (the OIDC 'sub'). Compared exactly; never an email." }
            }
          },
          "roles": {
            "type": "array",
            "minItems": 1,
            "uniqueItems": true,
            "description": "Opaque role names bound to this member. Their meaning is product policy, not part of this contract.",
            "items": { "type": "string", "minLength": 1 }
          }
        }
      }
    }
  }
}
